caves,a large underground chamber, typically of natural origin, in a hillside or cliff.,,,,,,No,"a large underground chamber, typically of natural origin, in a hillside or cliff.",,,,,,"a large underground chamber, typically of natural origin, in a hillside or cliff."
cavil,make petty or unnecessary objections.,,,,,,,,No,make petty or unnecessary objections.,,,,,,make petty or unnecessary objections.
cease,bring or come to an end.,,,,,,,,No,bring or come to an end.,,,,,,bring or come to an end.
cecal,relating to the cecum, the pouch connected to the junction of the small and large intestines.,,,,,,,No,"relating to the cecum, the pouch connected to the junction of the small and large intestines.",,,,,,"relating to the cecum, the pouch connected to the junction of the small and large intestines."
cecum,the part of the large intestine that is below the junction of the small intestine and that is blind-ended and larger in the horse and other herbivores than in humans or the carnivorous animals and has a large pouch at its base in humans.,,,,,,,,No,the part of the large intestine that is below the junction of the small intestine and that is blind-ended and larger in the horse and other herbivores than in humans or the carnivorous animals and has a large pouch at its base in humans.,,,,,,the part of the large intestine that is below the junction of the small intestine and that is blind-ended and larger in the horse and other herbivores than in humans or the carnivorous animals and has a large pouch at its base in humans.
cedar,a large coniferous tree with aromatic wood, native to the mountainous regions of the western US and Canada. ,,,,,,,No,"a large coniferous tree with aromatic wood, native to the mountainous regions of the western US and Canada. ",,,,,,"a large coniferous tree with aromatic wood, native to the mountainous regions of the western US and Canada. "
ceded,give up (power or territory).,,,,,,,,No,give up (power or territory).,,,,,,give up (power or territory).
cedes,formally surrender possession of.,,,,,,,,No,formally surrender possession of.,,,,,,formally surrender possession of.
ceili,a social event at which there is Scottish or Irish folk music and singing, traditional dancing, and storytelling.,,,,,,No,"a social event at which there is Scottish or Irish folk music and singing, traditional dancing, and storytelling.",,,,,,"a social event at which there is Scottish or Irish folk music and singing, traditional dancing, and storytelling."
celeb,a famous person.,,,,,,,,No,a famous person.,,,,,,a famous person.
cello,a bass instrument of the violin family, held upright on the floor between the legs of the seated player.,,,,,,,No,"a bass instrument of the violin family, held upright on the floor between the legs of the seated player.",,,,,,"a bass instrument of the violin family, held upright on the floor between the legs of the seated player."
cells,the smallest structural and functional unit of an organism, typically microscopic and consisting of cytoplasm and a nucleus enclosed in a membrane. ,,,,,,,No,"the smallest structural and functional unit of an organism, typically microscopic and consisting of cytoplasm and a nucleus enclosed in a membrane. ",,,,,,"the smallest structural and functional unit of an organism, typically microscopic and consisting of cytoplasm and a nucleus enclosed in a membrane. "
celts,a member of a group of peoples inhabiting much of Europe and Asia Minor in pre-Roman times, including the Gauls and the Irish.,,,,,,,No,"a member of a group of peoples inhabiting much of Europe and Asia Minor in pre-Roman times, including the Gauls and the Irish.",,,,,,"a member of a group of peoples inhabiting much of Europe and Asia Minor in pre-Roman times, including the Gauls and the Irish."
cents,a monetary unit of the United States, equal to one hundredth of a dollar.,,,,,,,No,"a monetary unit of the United States, equal to one hundredth of a dollar.",,,,,,"a monetary unit of the United States, equal to one hundredth of a dollar."
chads,a piece of waste paper produced by punching a hole.,,,,,,,,No,a piece of waste paper produced by punching a hole.,,,,,,a piece of waste paper produced by punching a hole.
chafe,(of something restrictive or too tight) make (a part of the body) sore by rubbing against it.,,,,,,,,No,(of something restrictive or too tight) make (a part of the body) sore by rubbing against it.,,,,,,(of something restrictive or too tight) make (a part of the body) sore by rubbing against it.
chaff,finely cut straw or hay used as fodder.,,,,,,,,No,finely cut straw or hay used as fodder.,,,,,,finely cut straw or hay used as fodder.
chain,a connected flexible series of metal links used for fastening or securing objects and pulling or supporting loads.,,,,,,,,No,a connected flexible series of metal links used for fastening or securing objects and pulling or supporting loads.,,,,,,a connected flexible series of metal links used for fastening or securing objects and pulling or supporting loads.
chair,a separate seat for one person, typically with a back and four legs.,,,,,,,No,"a separate seat for one person, typically with a back and four legs.",,,,,,"a separate seat for one person, typically with a back and four legs."
chalk,a white soft earthy limestone (calcium carbonate) formed from the skeletal remains of sea creatures.,,,,,,,,No,a white soft earthy limestone (calcium carbonate) formed from the skeletal remains of sea creatures.,,,,,,a white soft earthy limestone (calcium carbonate) formed from the skeletal remains of sea creatures.
champ,(of a horse) bite and paw the ground impatiently.,,,,,,,,No,(of a horse) bite and paw the ground impatiently.,,,,,,(of a horse) bite and paw the ground impatiently.
chana,an Indian dish of vegetables, fruit, or nuts cooked in spices and typically served with rice.,,,,,,No,"an Indian dish of vegetables, fruit, or nuts cooked in spices and typically served with rice.",,,,,,"an Indian dish of vegetables, fruit, or nuts cooked in spices and typically served with rice."
chant,say or shout repeatedly in a singsong tone.,,,,,,,,No,say or shout repeatedly in a singsong tone.,,,,,,say or shout repeatedly in a singsong tone.
chaos,complete disorder and confusion.,,,,,,,,No,complete disorder and confusion.,,,,,,complete disorder and confusion.
chaps,a man's leather leggings, now used especially by cowboys.,,,,,,,No,"a man's leather leggings, now used especially by cowboys.",,,,,,"a man's leather leggings, now used especially by cowboys."
chard,a beet of a variety with broad white leaf stalks that may be eaten as a vegetable.,,,,,,,,No,a beet of a variety with broad white leaf stalks that may be eaten as a vegetable.,,,,,,a beet of a variety with broad white leaf stalks that may be eaten as a vegetable.
charm,a small ornament worn on a necklace or bracelet.,,,,,,,,No,a small ornament worn on a necklace or bracelet.,,,,,,a small ornament worn on a necklace or bracelet.
chars,burn slightly and superficially so as to affect color.,,,,,,,,No,burn slightly and superficially so as to affect color.,,,,,,burn slightly and superficially so as to affect color.
chart,a sheet of information in the form of a table, graph, or diagram.,,,,,,No,"a sheet of information in the form of a table, graph, or diagram.",,,,,,"a sheet of information in the form of a table, graph, or diagram."
chase,pursue in order to catch or catch up with.,,,,,,,,No,pursue in order to catch or catch up with.,,,,,,pursue in order to catch or catch up with.
chasm,a deep fissure in the earth, rock, or another surface.,,,,,,No,"a deep fissure in the earth, rock, or another surface.",,,,,,"a deep fissure in the earth, rock, or another surface."
chats,talk in a friendly and informal way.,,,,,,,,No,talk in a friendly and informal way.,,,,,,talk in a friendly and informal way.
cheap,(of an item for sale) low in price; worth more than its cost.,,,,,,,,No,(of an item for sale) low in price; worth more than its cost.,,,,,,(of an item for sale) low in price; worth more than its cost.
cheat,act dishonestly or unfairly in order to gain an advantage.,,,,,,,,No,act dishonestly or unfairly in order to gain an advantage.,,,,,,act dishonestly or unfairly in order to gain an advantage.
check,examine (something) in order to determine its accuracy, quality, or condition, or to detect the presence of something.,,,,,No,"examine (something) in order to determine its accuracy, quality, or condition, or to detect the presence of something.",,,,,,"examine (something) in order to determine its accuracy, quality, or condition, or to detect the presence of something."
cheek,either side of the face below the eye.,,,,,,,,No,either side of the face below the eye.,,,,,,either side of the face below the eye.
cheep,(of a young bird) make a characteristic high-pitched sound.,,,,,,,,No,(of a young bird) make a characteristic high-pitched sound.,,,,,,(of a young bird) make a characteristic high-pitched sound.
cheer,shout for joy or in praise or encouragement.,,,,,,,,No,shout for joy or in praise or encouragement.,,,,,,shout for joy or in praise or encouragement.
chef,a professional cook, typically the chief cook in a restaurant or hotel.,,,,,,,No,"a professional cook, typically the chief cook in a restaurant or hotel.",,,,,,"a professional cook, typically the chief cook in a restaurant or hotel."
chemo,short for chemotherapy.,,,,,,,,No,short for chemotherapy.,,,,,,short for chemotherapy.
chert,a hard, dark, opaque rock composed of silica, found in limestone.,,,,,No,"a hard, dark, opaque rock composed of silica, found in limestone.",,,,,,"a hard, dark, opaque rock composed of silica, found in limestone."
chess,a board game of strategic skill for two players, played on a checkered board. Each player begins with sixteen pieces that are moved and used to capture opposing pieces according to precise rules. The object is to put the opponent's king under a direct attack from which escape is impossible.,,,,,,,No,"a board game of strategic skill for two players, played on a checkered board. Each player begins with sixteen pieces that are moved and used to capture opposing pieces according to precise rules. The object is to put the opponent's king under a direct attack from which escape is impossible.",,,,,,"a board game of strategic skill for two players, played on a checkered board. Each player begins with sixteen pieces that are moved and used to capture opposing pieces according to precise rules. The object is to put the opponent's king under a direct attack from which escape is impossible."
chest,the front surface of a person's or animal's body between the neck and the abdomen.,,,,,,,,No,the front surface of a person's or animal's body between the neck and the abdomen.,,,,,,the front surface of a person's or animal's body between the neck and the abdomen.
chews,bite and work (food) in the mouth with the teeth, especially to make it easier to swallow.,,,,,,,No,"bite and work (food) in the mouth with the teeth, especially to make it easier to swallow.",,,,,,"bite and work (food) in the mouth with the teeth, especially to make it easier to swallow."
chewy,(of food) needing to be chewed hard or for some time before being swallowed.,,,,,,,,No,(of food) needing to be chewed hard or for some time before being swallowed.,,,,,,(of food) needing to be chewed hard or for some time before being swallowed.
chica,a girl or young woman.,,,,,,,,No,a girl or young woman.,,,,,,a girl or young woman.
chick,a young bird, especially one newly hatched.,,,,,,,No,"a young bird, especially one newly hatched.",,,,,,"a young bird, especially one newly hatched."
chico,a boy or young man.,,,,,,,,No,a boy or young man.,,,,,,a boy or young man.
chide,scold or rebuke.,,,,,,,,No,scold or rebuke.,,,,,,scold or rebuke.
chief,(in the Middle Ages) a head man or leader, especially of a village or a clan.,,,,,,,No,"(in the Middle Ages) a head man or leader, especially of a village or a clan.",,,,,,"(in the Middle Ages) a head man or leader, especially of a village or a clan."
child,a young human being below the age of puberty or below the legal age of majority.,,,,,,,,No,a young human being below the age of puberty or below the legal age of majority.,,,,,,a young human being below the age of puberty or below the legal age of majority.
chile,a hot-tasting pod of any of a number of cultivated varieties of capsicum, used in cooking.,,,,,,,No,"a hot-tasting pod of any of a number of cultivated varieties of capsicum, used in cooking.",,,,,,"a hot-tasting pod of any of a number of cultivated varieties of capsicum, used in cooking."
chili,a small hot-tasting pod of a variety of capsicum, used chopped (and often dried) in sauces, relishes, and spice powders. There are various forms with pods of differing size, color, and strength of flavor, such as the relatively mild Anaheim and the extremely hot habanero.,,No,"a small hot-tasting pod of a variety of capsicum, used chopped (and often dried) in sauces, relishes, and spice powders. There are various forms with pods of differing size, color, and strength of flavor, such as the relatively mild Anaheim and the extremely hot habanero.",,,,,,"a small hot-tasting pod of a variety of capsicum, used chopped (and often dried) in sauces, relishes, and spice powders. There are various forms with pods of differing size, color, and strength of flavor, such as the relatively mild Anaheim and the extremely hot habanero."
chill,make (someone) cold.,,,,,,,,No,make (someone) cold.,,,,,,make (someone) cold.
chime,(of a bell or clock) make a melodious ringing sound.,,,,,,,,No,(of a bell or clock) make a melodious ringing sound.,,,,,,(of a bell or clock) make a melodious ringing sound.
chimp,(in general use) a monkey.,,,,,,,,No,(in general use) a monkey.,,,,,,(in general use) a monkey.
china,plates, dishes, cups, and other similar items, especially ones made of china.,,,,No,"plates, dishes, cups, and other similar items, especially ones made of china.",,,,,,"plates, dishes, cups, and other similar items, especially ones made of china."
chine,a spinal column, especially of an animal, or a ridge in a landscape.,,,,,,No,"a spinal column, especially of an animal, or a ridge in a landscape.",,,,,,"a spinal column, especially of an animal, or a ridge in a landscape."
ching,(of a kettle, pot, etc.) make a whistling sound when boiling.,,,,,,No,"(of a kettle, pot, etc.) make a whistling sound when boiling.",,,,,,"(of a kettle, pot, etc.) make a whistling sound when boiling."
chino,relating to China.,,,,,,,,No,relating to China.,,,,,,relating to China.
chins,(on a human or primate) the protruding part of the face below the mouth, formed by the apex of the lower jaw.,,,,,,,No,"(on a human or primate) the protruding part of the face below the mouth, formed by the apex of the lower jaw.",,,,,,"(on a human or primate) the protruding part of the face below the mouth, formed by the apex of the lower jaw."
chips,a thin slice of food made crisp by being fried, baked, or dried and typically eaten as a snack.,,,,,,No,"a thin slice of food made crisp by being fried, baked, or dried and typically eaten as a snack.",,,,,,"a thin slice of food made crisp by being fried, baked, or dried and typically eaten as a snack."
chirp,(of a small bird or an insect) make a shrill noise.,,,,,,,,No,(of a small bird or an insect) make a shrill noise.,,,,,,(of a small bird or an insect) make a shrill noise.
chits,a short official note, memorandum, or voucher, typically recording a sum owed.,,,,,No,"a short official note, memorandum, or voucher, typically recording a sum owed.",,,,,,"a short official note, memorandum, or voucher, typically recording a sum owed."
chive,a small bulbous plant that is related to the onion and has long slender leaves that are used as a culinary herb.,,,,,,,,No,a small bulbous plant that is related to the onion and has long slender leaves that are used as a culinary herb.,,,,,,a small bulbous plant that is related to the onion and has long slender leaves that are used as a culinary herb.
chock,a wedge or block placed against a wheel or rounded object, to prevent it from moving.,,,,,,,No,"a wedge or block placed against a wheel or rounded object, to prevent it from moving.",,,,,,"a wedge or block placed against a wheel or rounded object, to prevent it from moving."
choir,a group of people who sing together, especially in a church service.,,,,,,,No,"a group of people who sing together, especially in a church service.",,,,,,"a group of people who sing together, especially in a church service."
choke,make (someone) unable to breathe properly; asphyxiate.,,,,,,,,No,make (someone) unable to breathe properly; asphyxiate.,,,,,,make (someone) unable to breathe properly; asphyxiate.
chomp,the action or sound of chewing or munching heavily or noisily.,,,,,,,,No,the action or sound of chewing or munching heavily or noisily.,,,,,,the action or sound of chewing or munching heavily or noisily.
chops,the lower part of the face, especially the fleshy lower part of each side of the jaw.,,,,,,,No,"the lower part of the face, especially the fleshy lower part of each side of the jaw.",,,,,,"the lower part of the face, especially the fleshy lower part of each side of the jaw."
chord,a group of (typically three or more) notes sounded together, as a basis of harmony.,,,,,,,No,"a group of (typically three or more) notes sounded together, as a basis of harmony.",,,,,,"a group of (typically three or more) notes sounded together, as a basis of harmony."
chore,a routine task, especially a household one.,,,,,,,No,"a routine task, especially a household one.",,,,,,"a routine task, especially a household one."
chose,select (someone or something) from a number of alternatives; pick out.,,,,,,,,No,select (someone or something) from a number of alternatives; pick out.,,,,,,select (someone or something) from a number of alternatives; pick out.
chows,food.,,,,,,,,No,food.,,,,,,food.
chubs,a North American freshwater fish of the minnow family, with a thick-lipped mouth.,,,,,,,No,"a North American freshwater fish of the minnow family, with a thick-lipped mouth.",,,,,,"a North American freshwater fish of the minnow family, with a thick-lipped mouth."
chuck,throw (something) carelessly or casually.,,,,,,,,No,throw (something) carelessly or casually.,,,,,,throw (something) carelessly or casually.
chuff,a rude or gruff sound made by a person to express discontent.,,,,,,,,No,a rude or gruff sound made by a person to express discontent.,,,,,,a rude or gruff sound made by a person to express discontent.
chugs,(of a person or vehicle) move slowly with much effort.,,,,,,,,No,(of a person or vehicle) move slowly with much effort.,,,,,,(of a person or vehicle) move slowly with much effort.
chump,a foolish or easily deceived person.,,,,,,,,No,a foolish or easily deceived person.,,,,,,a foolish or easily deceived person.
chums,a close friend.,,,,,,,,No,a close friend.,,,,,,a close friend.
chunk,a thick, solid piece of something.,,,,,,,No,"a thick, solid piece of something.",,,,,,"a thick, solid piece of something."
churn,stir or agitate (milk or cream) in a machine in order to produce butter.,,,,,,,,No,stir or agitate (milk or cream) in a machine in order to produce butter.,,,,,,stir or agitate (milk or cream) in a machine in order to produce butter.
chute,a sloping channel or slide for conveying things to a lower level.,,,,,,,,No,a sloping channel or slide for conveying things to a lower level.,,,,,,a sloping channel or slide for conveying things to a lower level.
cider,a fermented alcoholic drink made from apple juice; cider.,,,,,,,,No,a fermented alcoholic drink made from apple juice; cider.,,,,,,a fermented alcoholic drink made from apple juice; cider.
cinch,a girth for a saddle.,,,,,,,,No,a girth for a saddle.,,,,,,a girth for a saddle.
circa,(often preceding a date) approximately.,,,,,,,,No,(often preceding a date) approximately.,,,,,,(often preceding a date) approximately.
cisco,a small North American whitefish, typically living in clear cold water.,,,,,,,No,"a small North American whitefish, typically living in clear cold water.",,,,,,"a small North American whitefish, typically living in clear cold water."
cited,quote (a passage, book, or author) as evidence for or justification of an argument or statement, especially in a scholarly work.,,,,,No,"quote (a passage, book, or author) as evidence for or justification of an argument or statement, especially in a scholarly work.",,,,,,"quote (a passage, book, or author) as evidence for or justification of an argument or statement, especially in a scholarly work."
cites,quote (a passage, book, or author) as evidence for or justification of an argument or statement, especially in a scholarly work.,,,,,No,"quote (a passage, book, or author) as evidence for or justification of an argument or statement, especially in a scholarly work.",,,,,,"quote (a passage, book, or author) as evidence for or justification of an argument or statement, especially in a scholarly work."
civet,a small, lean, mostly nocturnal mammal native to tropical Asia and Africa, known for its ability to secrete a musky fluid for defense or marking territory.,,,,,No,"a small, lean, mostly nocturnal mammal native to tropical Asia and Africa, known for its ability to secrete a musky fluid for defense or marking territory.",,,,,,"a small, lean, mostly nocturnal mammal native to tropical Asia and Africa, known for its ability to secrete a musky fluid for defense or marking territory."
civic,of or relating to a city or town, especially its administration; municipal.,,,,,,,No,"of or relating to a city or town, especially its administration; municipal.",,,,,,"of or relating to a city or town, especially its administration; municipal."
civil,relating to ordinary citizens and their concerns, as distinct from military or ecclesiastical matters.,,,,,,,No,"relating to ordinary citizens and their concerns, as distinct from military or ecclesiastical matters.",,,,,,"relating to ordinary citizens and their concerns, as distinct from military or ecclesiastical matters."
civvy,a person who is not on active duty with a military, naval, police, or fire fighting force.,,,,,No,"a person who is not on active duty with a military, naval, police, or fire fighting force.",,,,,,"a person who is not on active duty with a military, naval, police, or fire fighting force."
clack,make or cause to make a sound by striking together.,,,,,,,,No,make or cause to make a sound by striking together.,,,,,,make or cause to make a sound by striking together.
clade,a group of organisms believed to have evolved from a common ancestor, according to the principles of cladistics.,,,,,,,No,"a group of organisms believed to have evolved from a common ancestor, according to the principles of cladistics.",,,,,,"a group of organisms believed to have evolved from a common ancestor, according to the principles of cladistics."
claim,state or assert that something is the case, typically without providing evidence or proof.,,,,,,,No,"state or assert that something is the case, typically without providing evidence or proof.",,,,,,"state or assert that something is the case, typically without providing evidence or proof."
clamp,fasten (something) in place with a clamp.,,,,,,,,No,fasten (something) in place with a clamp.,,,,,,fasten (something) in place with a clamp.
clams,an edible marine bivalve with a shell that is slightly open.,,,,,,,,No,an edible marine bivalve with a shell that is slightly open.,,,,,,an edible marine bivalve with a shell that is slightly open.
clang,a loud, resonant metallic sound or series of sounds.,,,,,,,No,"a loud, resonant metallic sound or series of sounds.",,,,,,"a loud, resonant metallic sound or series of sounds."
clank,a loud, sharp sound or series of sounds, typically made by pieces of metal meeting.,,,,,,No,"a loud, sharp sound or series of sounds, typically made by pieces of metal meeting.",,,,,,"a loud, sharp sound or series of sounds, typically made by pieces of metal meeting."
clans,a group of close-knit and interrelated families (especially associated with families in the Scottish Highlands).,,,,,,,,No,a group of close-knit and interrelated families (especially associated with families in the Scottish Highlands).,,,,,,a group of close-knit and interrelated families (especially associated with families in the Scottish Highlands).
claps,strike the palms of (one's hands) together repeatedly, typically in order to applaud.,,,,,,,No,"strike the palms of (one's hands) together repeatedly, typically in order to applaud.",,,,,,"strike the palms of (one's hands) together repeatedly, typically in order to applaud."
clash,(of two things) collide forcefully or angrily.,,,,,,,,No,(of two things) collide forcefully or angrily.,,,,,,(of two things) collide forcefully or angrily.
clasp,grasp (something) tightly with one's hand.,,,,,,,,No,grasp (something) tightly with one's hand.,,,,,,grasp (something) tightly with one's hand.
class,a set or category of things having some property or attribute in common and differentiated from others by kind, type, or quality.,,,,,,No,"a set or category of things having some property or attribute in common and differentiated from others by kind, type, or quality.",,,,,,"a set or category of things having some property or attribute in common and differentiated from others by kind, type, or quality."
clave,each of a pair of hardwood sticks that are struck together to make a sharp ringing sound, used especially in Spanish, Latin American, and Caribbean music.,,,,,No,"each of a pair of hardwood sticks that are struck together to make a sharp ringing sound, used especially in Spanish, Latin American, and Caribbean music.",,,,,,"each of a pair of hardwood sticks that are struck together to make a sharp ringing sound, used especially in Spanish, Latin American, and Caribbean music."
