coped,deal effectively with something difficult.,,,,,,,,No,deal effectively with something difficult.,,,,,,deal effectively with something difficult.
coper,a person who deals effectively with something difficult.,,,,,,,,No,a person who deals effectively with something difficult.,,,,,,a person who deals effectively with something difficult.
copes,deal effectively with something difficult.,,,,,,,,No,deal effectively with something difficult.,,,,,,deal effectively with something difficult.
copra,the dried meat of the coconut, from which coconut oil is extracted.,,,,,,,No,"the dried meat of the coconut, from which coconut oil is extracted.",,,,,,"the dried meat of the coconut, from which coconut oil is extracted."
copse,a small group of trees.,,,,,,,,No,a small group of trees.,,,,,,a small group of trees.
coral,a hard stony substance secreted by certain marine coelenterates as an external skeleton, typically forming large reefs in warm seas.,,,,,,,No,"a hard stony substance secreted by certain marine coelenterates as an external skeleton, typically forming large reefs in warm seas.",,,,,,"a hard stony substance secreted by certain marine coelenterates as an external skeleton, typically forming large reefs in warm seas."
cords,a long, thin, flexible string or rope made from several twisted strands.,,,,,,No,"a long, thin, flexible string or rope made from several twisted strands.",,,,,,"a long, thin, flexible string or rope made from several twisted strands."
cored,remove the tough central part and seeds from (a fruit).,,,,,,,,No,remove the tough central part and seeds from (a fruit).,,,,,,remove the tough central part and seeds from (a fruit).
corer,a device for removing the core from an apple or similar fruit.,,,,,,,,No,a device for removing the core from an apple or similar fruit.,,,,,,a device for removing the core from an apple or similar fruit.
cores,the tough central part and seeds of a fruit, especially those of an apple or pear.,,,,,,,No,"the tough central part and seeds of a fruit, especially those of an apple or pear.",,,,,,"the tough central part and seeds of a fruit, especially those of an apple or pear."
corgi,a dog of a short-legged, long-backed breed.,,,,,,,No,"a dog of a short-legged, long-backed breed.",,,,,,"a dog of a short-legged, long-backed breed."
corks,a stopper for sealing a bottle, especially one made of cork.,,,,,,,No,"a stopper for sealing a bottle, especially one made of cork.",,,,,,"a stopper for sealing a bottle, especially one made of cork."
corky,resembling cork in texture or appearance.,,,,,,,,No,resembling cork in texture or appearance.,,,,,,resembling cork in texture or appearance.
corms,a short, vertical, swollen underground plant stem that serves as a storage organ used by some plants to survive winter or other adverse conditions such as summer drought and heat (perennation).,,,,,,No,"a short, vertical, swollen underground plant stem that serves as a storage organ used by some plants to survive winter or other adverse conditions such as summer drought and heat (perennation).",,,,,,"a short, vertical, swollen underground plant stem that serves as a storage organ used by some plants to survive winter or other adverse conditions such as summer drought and heat (perennation)."
corns,a small, hard, seed-like fruit or seed of a cereal plant.,,,,,,No,"a small, hard, seed-like fruit or seed of a cereal plant.",,,,,,"a small, hard, seed-like fruit or seed of a cereal plant."
cornu,(anatomy) a projecting part or prominence, especially of bone.,,,,,,,No,"(anatomy) a projecting part or prominence, especially of bone.",,,,,,"(anatomy) a projecting part or prominence, especially of bone."
corny,(of a joke or other humorous event) stale, trite, or overly sentimental.,,,,,,No,"(of a joke or other humorous event) stale, trite, or overly sentimental.",,,,,,"(of a joke or other humorous event) stale, trite, or overly sentimental."
corps,a main subdivision of an army in the field, consisting of two or more divisions.,,,,,,,No,"a main subdivision of an army in the field, consisting of two or more divisions.",,,,,,"a main subdivision of an army in the field, consisting of two or more divisions."
costs,(in economics) the value of money that has been used up to produce something, and therefore is not available for use anymore.,,,,,,,No,"(in economics) the value of money that has been used up to produce something, and therefore is not available for use anymore.",,,,,,"(in economics) the value of money that has been used up to produce something, and therefore is not available for use anymore."
cotta,a short surplice, typically sleeveless or with short sleeves, worn over a cassock by clergy and choristers.,,,,,,No,"a short surplice, typically sleeveless or with short sleeves, worn over a cassock by clergy and choristers.",,,,,,"a short surplice, typically sleeveless or with short sleeves, worn over a cassock by clergy and choristers."
couch,a long upholstered piece of furniture for several people to sit on.,,,,,,,,No,a long upholstered piece of furniture for several people to sit on.,,,,,,a long upholstered piece of furniture for several people to sit on.
cough,expel air from the lungs with a sudden sharp sound.,,,,,,,,No,expel air from the lungs with a sudden sharp sound.,,,,,,expel air from the lungs with a sudden sharp sound.
could,used to indicate past ability or permission.,,,,,,,,No,used to indicate past ability or permission.,,,,,,used to indicate past ability or permission.
count,recite or display numbers backward to zero to indicate the time remaining before the launch of a rocket or the start of an operation.,,,,,,,,No,recite or display numbers backward to zero to indicate the time remaining before the launch of a rocket or the start of an operation.,,,,,,recite or display numbers backward to zero to indicate the time remaining before the launch of a rocket or the start of an operation.
coupe,a car with a fixed roof and two doors.,,,,,,,,No,a car with a fixed roof and two doors.,,,,,,a car with a fixed roof and two doors.
coups,a sudden, violent, and illegal seizure of power from a government.,,,,,,No,"a sudden, violent, and illegal seizure of power from a government.",,,,,,"a sudden, violent, and illegal seizure of power from a government."
court,a tribunal presided over by a judge, judges, or a magistrate in civil and criminal cases.,,,,,,No,"a tribunal presided over by a judge, judges, or a magistrate in civil and criminal cases.",,,,,,"a tribunal presided over by a judge, judges, or a magistrate in civil and criminal cases."
coven,a group or gathering of witches who meet regularly.,,,,,,,,No,a group or gathering of witches who meet regularly.,,,,,,a group or gathering of witches who meet regularly.
cover,put something such as a cloth or lid on top of or in front of (something) in order to protect or conceal it.,,,,,,,,No,put something such as a cloth or lid on top of or in front of (something) in order to protect or conceal it.,,,,,,put something such as a cloth or lid on top of or in front of (something) in order to protect or conceal it.
coves,a small sheltered bay in the coastline of a sea, river, or lake.,,,,,,No,"a small sheltered bay in the coastline of a sea, river, or lake.",,,,,,"a small sheltered bay in the coastline of a sea, river, or lake."
covet,yearn to possess or have (something).,,,,,,,,No,yearn to possess or have (something).,,,,,,yearn to possess or have (something).
covey,a small group of people or things.,,,,,,,,No,a small group of people or things.,,,,,,a small group of people or things.
cowed,cause (someone) to submit to one's wishes by intimidation.,,,,,,,,No,cause (someone) to submit to one's wishes by intimidation.,,,,,,cause (someone) to submit to one's wishes by intimidation.
cower,crouch down in fear.,,,,,,,,No,crouch down in fear.,,,,,,crouch down in fear.
coyer,reluctant to give information owing to caution or suspicion.,,,,,,,,No,reluctant to give information owing to caution or suspicion.,,,,,,reluctant to give information owing to caution or suspicion.
coyly,artfully or affectedly shy or reserved; slyly hesitant; coquettish.,,,,,,,,No,artfully or affectedly shy or reserved; slyly hesitant; coquettish.,,,,,,artfully or affectedly shy or reserved; slyly hesitant; coquettish.
cozen,trick or deceive.,,,,,,,,No,trick or deceive.,,,,,,trick or deceive.
cozy,suggesting or contributing to warmth and friendliness.,,,,,,,,No,suggesting or contributing to warmth and friendliness.,,,,,,suggesting or contributing to warmth and friendliness.
crabs,a crustacean of the family Brachyura, having a very short tail and a broad, flattened carapace.,,,,,,No,"a crustacean of the family Brachyura, having a very short tail and a broad, flattened carapace.",,,,,,"a crustacean of the family Brachyura, having a very short tail and a broad, flattened carapace."
crack,a narrow space between parts of something, typically one that has broken or been taken apart.,,,,,,,No,"a narrow space between parts of something, typically one that has broken or been taken apart.",,,,,,"a narrow space between parts of something, typically one that has broken or been taken apart."
craft,an activity involving skill in making things by hand.,,,,,,,,No,an activity involving skill in making things by hand.,,,,,,an activity involving skill in making things by hand.
crags,a steep or rugged cliff or rock face.,,,,,,,,No,a steep or rugged cliff or rock face.,,,,,,a steep or rugged cliff or rock face.
cramp,a painful, involuntary contraction of a muscle or muscles, typically caused by fatigue or strain.,,,,,,No,"a painful, involuntary contraction of a muscle or muscles, typically caused by fatigue or strain.",,,,,,"a painful, involuntary contraction of a muscle or muscles, typically caused by fatigue or strain."
crane,a large, tall machine used for moving heavy objects by suspending them from a projecting arm or beam.,,,,,,,No,"a large, tall machine used for moving heavy objects by suspending them from a projecting arm or beam.",,,,,,"a large, tall machine used for moving heavy objects by suspending them from a projecting arm or beam."
crank,turn the crankshaft of (an internal combustion engine) in order to start the engine.,,,,,,,,No,turn the crankshaft of (an internal combustion engine) in order to start the engine.,,,,,,turn the crankshaft of (an internal combustion engine) in order to start the engine.
crape,a thin, light, delicate fabric produced by weaving with silk, polyester, or other fibers with a gauze-like texture.,,,,No,"a thin, light, delicate fabric produced by weaving with silk, polyester, or other fibers with a gauze-like texture.",,,,,,"a thin, light, delicate fabric produced by weaving with silk, polyester, or other fibers with a gauze-like texture."
craps,(informal) nonsense.,,,,,,,,No,(informal) nonsense.,,,,,,(informal) nonsense.
crash,(of a vehicle) collide violently with an obstacle or another vehicle.,,,,,,,,No,(of a vehicle) collide violently with an obstacle or another vehicle.,,,,,,(of a vehicle) collide violently with an obstacle or another vehicle.
crass,(of a person or their behavior) stupid; coarse.,,,,,,,,No,(of a person or their behavior) stupid; coarse.,,,,,,(of a person or their behavior) stupid; coarse.
crate,a slatted wooden case used for transporting or storing goods.,,,,,,,,No,a slatted wooden case used for transporting or storing goods.,,,,,,a slatted wooden case used for transporting or storing goods.
crave,feel a powerful desire for (something).,,,,,,,,No,feel a powerful desire for (something).,,,,,,feel a powerful desire for (something).
crawl,(of a person) move forward on the hands and knees or by dragging the body close to the ground.,,,,,,,,No,(of a person) move forward on the hands and knees or by dragging the body close to the ground.,,,,,,(of a person) move forward on the hands and knees or by dragging the body close to the ground.
craws,the crop of a bird or insect.,,,,,,,,No,the crop of a bird or insect.,,,,,,the crop of a bird or insect.
craze,a widespread enthusiasm for something; a craze.,,,,,,,,No,a widespread enthusiasm for something; a craze.,,,,,,a widespread enthusiasm for something; a craze.
crazy,mentally deranged, especially as manifested in a wild or aggressive way.,,,,,,,No,"mentally deranged, especially as manifested in a wild or aggressive way.",,,,,,"mentally deranged, especially as manifested in a wild or aggressive way."
creak,a harsh, high-pitched sound, typically made by a door or floorboard.,,,,,,No,"a harsh, high-pitched sound, typically made by a door or floorboard.",,,,,,"a harsh, high-pitched sound, typically made by a door or floorboard."
cream,the thick white or pale yellow fatty liquid that rises to the top when milk is left to stand and that can be eaten as an accompaniment to desserts or used as a cooking ingredient.,,,,,,,,No,the thick white or pale yellow fatty liquid that rises to the top when milk is left to stand and that can be eaten as an accompaniment to desserts or used as a cooking ingredient.,,,,,,the thick white or pale yellow fatty liquid that rises to the top when milk is left to stand and that can be eaten as an accompaniment to desserts or used as a cooking ingredient.
credo,a statement of the beliefs or aims that guide someone's actions.,,,,,,,,No,a statement of the beliefs or aims that guide someone's actions.,,,,,,a statement of the beliefs or aims that guide someone's actions.
creed,a system of Christian or other religious belief; a faith.,,,,,,,,No,a system of Christian or other religious belief; a faith.,,,,,,a system of Christian or other religious belief; a faith.
creek,a stream, brook, or minor tributary of a river.,,,,,,No,"a stream, brook, or minor tributary of a river.",,,,,,"a stream, brook, or minor tributary of a river."
creel,a wicker basket for holding fish that have just been caught.,,,,,,,,No,a wicker basket for holding fish that have just been caught.,,,,,,a wicker basket for holding fish that have just been caught.
creep,(of a person) move slowly and carefully in order to avoid being heard or noticed.,,,,,,,,No,(of a person) move slowly and carefully in order to avoid being heard or noticed.,,,,,,(of a person) move slowly and carefully in order to avoid being heard or noticed.
creme,a sweet liqueur with a high sugar content.,,,,,,,,No,a sweet liqueur with a high sugar content.,,,,,,a sweet liqueur with a high sugar content.
crepe,a thin pancake.,,,,,,,,No,a thin pancake.,,,,,,a thin pancake.
crept,(past tense and past participle of creep) move slowly and carefully in order to avoid being heard or noticed.,,,,,,,,No,(past tense and past participle of creep) move slowly and carefully in order to avoid being heard or noticed.,,,,,,(past tense and past participle of creep) move slowly and carefully in order to avoid being heard or noticed.
crest,the top of something, especially a mountain or hill.,,,,,,,No,"the top of something, especially a mountain or hill.",,,,,,"the top of something, especially a mountain or hill."
crews,a group of people who work together on a ship.,,,,,,,,No,a group of people who work together on a ship.,,,,,,a group of people who work together on a ship.
cribs,a young child's bed with barred or latticed sides.,,,,,,,,No,a young child's bed with barred or latticed sides.,,,,,,a young child's bed with barred or latticed sides.
crick,a painful muscle spasm, especially in the neck or back.,,,,,,,No,"a painful muscle spasm, especially in the neck or back.",,,,,,"a painful muscle spasm, especially in the neck or back."
cried,shed tears, typically as an expression of distress, pain, or sorrow.,,,,,No,"shed tears, typically as an expression of distress, pain, or sorrow.",,,,,,"shed tears, typically as an expression of distress, pain, or sorrow."
crier,a person who cries, especially one who shouts street cries.,,,,,,,No,"a person who cries, especially one who shouts street cries.",,,,,,"a person who cries, especially one who shouts street cries."
cries,shed tears, typically as an expression of distress, pain, or sorrow.,,,,,No,"shed tears, typically as an expression of distress, pain, or sorrow.",,,,,,"shed tears, typically as an expression of distress, pain, or sorrow."
crime,an action or omission that constitutes an offense that may be prosecuted by the state and is punishable by law.,,,,,,,,No,an action or omission that constitutes an offense that may be prosecuted by the state and is punishable by law.,,,,,,an action or omission that constitutes an offense that may be prosecuted by the state and is punishable by law.
crimp,compress (something) into small folds or ridges.,,,,,,,,No,compress (something) into small folds or ridges.,,,,,,compress (something) into small folds or ridges.
crisp,(of a substance) firm, dry, and brittle, especially in a way considered pleasing or attractive.,,,,,No,"(of a substance) firm, dry, and brittle, especially in a way considered pleasing or attractive.",,,,,,"(of a substance) firm, dry, and brittle, especially in a way considered pleasing or attractive."
crits,comment or judgment, especially one of a disparaging or dismissive nature.,,,,,,,No,"comment or judgment, especially one of a disparaging or dismissive nature.",,,,,,"comment or judgment, especially one of a disparaging or dismissive nature."
croak,make a deep hoarse sound, typically in dying.,,,,,,,No,"make a deep hoarse sound, typically in dying.",,,,,,"make a deep hoarse sound, typically in dying."
crock,a large earthenware storage jar or pot.,,,,,,,,No,a large earthenware storage jar or pot.,,,,,,a large earthenware storage jar or pot.
croft,a small rented farm, especially one in Scotland, comprising a plot of arable land attached to a house and with a right of pasturage held in common with other such farms.,,,,,,No,"a small rented farm, especially one in Scotland, comprising a plot of arable land attached to a house and with a right of pasturage held in common with other such farms.",,,,,,"a small rented farm, especially one in Scotland, comprising a plot of arable land attached to a house and with a right of pasturage held in common with other such farms."
crone,(informal) an old woman who is thin and ugly.,,,,,,,,No,(informal) an old woman who is thin and ugly.,,,,,,(informal) an old woman who is thin and ugly.
crony,a close friend or companion.,,,,,,,,No,a close friend or companion.,,,,,,a close friend or companion.
crook,a person who is dishonest or a criminal.,,,,,,,,No,a person who is dishonest or a criminal.,,,,,,a person who is dishonest or a criminal.
croon,hum or sing in a soft, low voice, especially in a sentimental manner.,,,,,,No,"hum or sing in a soft, low voice, especially in a sentimental manner.",,,,,,"hum or sing in a soft, low voice, especially in a sentimental manner."
crore,(in Indian English) ten million (used in units of rupees, especially to express large sums of money).,,,,,,,No,"(in Indian English) ten million (used in units of rupees, especially to express large sums of money).",,,,,,"(in Indian English) ten million (used in units of rupees, especially to express large sums of money)."
cross,(of an angry person) annoyed and irritated.,,,,,,,,No,(of an angry person) annoyed and irritated.,,,,,,(of an angry person) annoyed and irritated.
croup,a respiratory condition that results in a barking cough, hoarse voice, and difficulty breathing.,,,,,,No,"a respiratory condition that results in a barking cough, hoarse voice, and difficulty breathing.",,,,,,"a respiratory condition that results in a barking cough, hoarse voice, and difficulty breathing."
crowd,a large number of people gathered together in a disorganized or unruly way.,,,,,,,,No,a large number of people gathered together in a disorganized or unruly way.,,,,,,a large number of people gathered together in a disorganized or unruly way.
crown,a circular ornamental headdress worn by a monarch as a symbol of authority, usually made of or decorated with precious metals and jewels.,,,,,,,No,"a circular ornamental headdress worn by a monarch as a symbol of authority, usually made of or decorated with precious metals and jewels.",,,,,,"a circular ornamental headdress worn by a monarch as a symbol of authority, usually made of or decorated with precious metals and jewels."
crows,a large perching bird with mostly glossy black plumage, a heavy bill, and a raucous voice.,,,,,,No,"a large perching bird with mostly glossy black plumage, a heavy bill, and a raucous voice.",,,,,,"a large perching bird with mostly glossy black plumage, a heavy bill, and a raucous voice."
crude,in a natural or raw state; not yet processed or refined.,,,,,,,,No,in a natural or raw state; not yet processed or refined.,,,,,,in a natural or raw state; not yet processed or refined.
cruel,willfully causing pain or suffering to others, or feeling no concern about it.,,,,,,,No,"willfully causing pain or suffering to others, or feeling no concern about it.",,,,,,"willfully causing pain or suffering to others, or feeling no concern about it."
cruet,a small container for salt, pepper, oil, or vinegar for use at a dining table.,,,,,No,"a small container for salt, pepper, oil, or vinegar for use at a dining table.",,,,,,"a small container for salt, pepper, oil, or vinegar for use at a dining table."
crumb,a small particle of bread, cake, or cracker.,,,,,,No,"a small particle of bread, cake, or cracker.",,,,,,"a small particle of bread, cake, or cracker."
crump,a crunching or scrunching sound.,,,,,,,,No,a crunching or scrunching sound.,,,,,,a crunching or scrunching sound.
cruse,a small earthenware container for liquids; a jar or jug.,,,,,,,,No,a small earthenware container for liquids; a jar or jug.,,,,,,a small earthenware container for liquids; a jar or jug.
crush,compress or squeeze forcefully so as to break, damage, or distort in shape.,,,,,,No,"compress or squeeze forcefully so as to break, damage, or distort in shape.",,,,,,"compress or squeeze forcefully so as to break, damage, or distort in shape."
crust,the tough outer layer of something.,,,,,,,,No,the tough outer layer of something.,,,,,,the tough outer layer of something.
crypt,a room or vault beneath a church, used as a chapel or burial place.,,,,,,,No,"a room or vault beneath a church, used as a chapel or burial place.",,,,,,"a room or vault beneath a church, used as a chapel or burial place."
cubby,a small room or cupboard.,,,,,,,,No,a small room or cupboard.,,,,,,a small room or cupboard.
cubed,cut (something, especially food) into small cubes.,,,,,,,No,"cut (something, especially food) into small cubes.",,,,,,"cut (something, especially food) into small cubes."
cubes,a symmetrical three-dimensional shape, either solid or hollow, contained by six equal squares.,,,,,,No,"a symmetrical three-dimensional shape, either solid or hollow, contained by six equal squares.",,,,,,"a symmetrical three-dimensional shape, either solid or hollow, contained by six equal squares."
cubic,having three dimensions.,,,,,,,,No,having three dimensions.,,,,,,having three dimensions.
cubit,an ancient unit of linear measure, equivalent to the length of the forearm from the elbow to the tip of the middle finger (about 18 inches).,,,,,,,No,"an ancient unit of linear measure, equivalent to the length of the forearm from the elbow to the tip of the middle finger (about 18 inches).",,,,,,"an ancient unit of linear measure, equivalent to the length of the forearm from the elbow to the tip of the middle finger (about 18 inches)."
cuddy,a small room, cabin, or cupboard.,,,,,,No,"a small room, cabin, or cupboard.",,,,,,"a small room, cabin, or cupboard."
cuffs,the end part of a sleeve, where the material of the sleeve is turned back or a separate band is sewn on.,,,,,,,No,"the end part of a sleeve, where the material of the sleeve is turned back or a separate band is sewn on.",,,,,,"the end part of a sleeve, where the material of the sleeve is turned back or a separate band is sewn on."
culls,select from a large quantity; obtain from a variety of sources.,,,,,,,,No,select from a large quantity; obtain from a variety of sources.,,,,,,select from a large quantity; obtain from a variety of sources.
culpa,(Law) a defendant's admission of guilt in a criminal case.,,,,,,,,No,(Law) a defendant's admission of guilt in a criminal case.,,,,,,(Law) a defendant's admission of guilt in a criminal case.
cults,a system of religious veneration and devotion directed toward a particular figure or object.,,,,,,,,No,a system of religious veneration and devotion directed toward a particular figure or object.,,,,,,a system of religious veneration and devotion directed toward a particular figure or object.
cumin,a pungent spice consisting of the dried, aromatic seeds of a plant of the parsley family, used especially in Indian cooking.,,,,,,No,"a pungent spice consisting of the dried, aromatic seeds of a plant of the parsley family, used especially in Indian cooking.",,,,,,"a pungent spice consisting of the dried, aromatic seeds of a plant of the parsley family, used especially in Indian cooking."
cupid,the god of love, son of Venus; represented as a winged, blindfolded boy with a bow and arrow.,,,,,,No,"the god of love, son of Venus; represented as a winged, blindfolded boy with a bow and arrow.",,,,,,"the god of love, son of Venus; represented as a winged, blindfolded boy with a bow and arrow."
cuppa,(British) a cup of tea.,,,,,,,,No,(British) a cup of tea.,,,,,,(British) a cup of tea.
curbs,a stone or concrete edging to a street or path.,,,,,,,,No,a stone or concrete edging to a street or path.,,,,,,a stone or concrete edging to a street or path.
curds,a soft, white substance formed when milk coagulates, used as the basis for cheese.,,,,,,No,"a soft, white substance formed when milk coagulates, used as the basis for cheese.",,,,,,"a soft, white substance formed when milk coagulates, used as the basis for cheese."
