aback,taken by surprise or caught off guard,,,,,,,,No,taken by surprise or caught off guard,,,,,,taken by surprise or caught off guard
abase,to lower in rank, office, prestige, or esteem,,,,,No,"to lower in rank, office, prestige, or esteem",,,,,,"to lower in rank, office, prestige, or esteem"
abate,to reduce in degree or intensity; lessen,,,,,,,,No,to reduce in degree or intensity; lessen,,,,,,to reduce in degree or intensity; lessen
abaya,a loose, usually black robe worn by Muslim women, especially in Arabic-speaking regions, covering the body from head to toe,,,,,No,"a loose, usually black robe worn by Muslim women, especially in Arabic-speaking regions, covering the body from head to toe",,,,,,"a loose, usually black robe worn by Muslim women, especially in Arabic-speaking regions, covering the body from head to toe"
abbey,a monastery or convent under the authority of an abbot or abbess,,,,,,,,No,a monastery or convent under the authority of an abbot or abbess,,,,,,a monastery or convent under the authority of an abbot or abbess
abbot,the superior of a monastery or abbey,,,,,,,,No,the superior of a monastery or abbey,,,,,,the superior of a monastery or abbey
abets,to encourage or assist (someone) to do something wrong, in particular, to commit a crime or other offense,,,,,,No,"to encourage or assist (someone) to do something wrong, in particular, to commit a crime or other offense",,,,,,"to encourage or assist (someone) to do something wrong, in particular, to commit a crime or other offense"
abhor,to regard with disgust and hatred,,,,,,,,No,to regard with disgust and hatred,,,,,,to regard with disgust and hatred
abide,to accept or act in accordance with a rule, decision, or recommendation,,,,,,No,"to accept or act in accordance with a rule, decision, or recommendation",,,,,,"to accept or act in accordance with a rule, decision, or recommendation"
abode,a place of residence; a house or home,,,,,,,,No,a place of residence; a house or home,,,,,,a place of residence; a house or home
abort,to terminate before completion; to fail to complete successfully,,,,,,,,No,to terminate before completion; to fail to complete successfully,,,,,,to terminate before completion; to fail to complete successfully
about,on the subject of; concerning,,,,,,,,No,on the subject of; concerning,,,,,,on the subject of; concerning
above,at a higher level or layer than; higher than in position,,,,,,,,No,at a higher level or layer than; higher than in position,,,,,,at a higher level or layer than; higher than in position
abuse,the improper use of something; misuse,,,,,,,,No,the improper use of something; misuse,,,,,,the improper use of something; misuse
abuts,to be adjacent to; to touch or lean on at one end or side,,,,,,,,No,to be adjacent to; to touch or lean on at one end or side,,,,,,to be adjacent to; to touch or lean on at one end or side
abyss,a deep or seemingly bottomless chasm,,,,,,,,No,a deep or seemingly bottomless chasm,,,,,,a deep or seemingly bottomless chasm
ached,experienced a dull, continuous pain,,,,,,,No,"experienced a dull, continuous pain",,,,,,"experienced a dull, continuous pain"
aches,pains or distresses,,,,,,,,No,pains or distresses,,,,,,pains or distresses
acids,a chemical substance that neutralizes alkalis, dissolves some metals, and turns litmus red,,,,,,No,"a chemical substance that neutralizes alkalis, dissolves some metals, and turns litmus red",,,,,,"a chemical substance that neutralizes alkalis, dissolves some metals, and turns litmus red"
acing,to achieve high marks or perform very well in an examination or competition,,,,,,,,No,to achieve high marks or perform very well in an examination or competition,,,,,,to achieve high marks or perform very well in an examination or competition
ackee,a tropical fruit with red or yellow skin and edible yellow flesh,,,,,,,,No,a tropical fruit with red or yellow skin and edible yellow flesh,,,,,,a tropical fruit with red or yellow skin and edible yellow flesh
acorn,the fruit of the oak tree, a smooth oval nut in a rough cup-like base,,,,,,,No,"the fruit of the oak tree, a smooth oval nut in a rough cup-like base",,,,,,"the fruit of the oak tree, a smooth oval nut in a rough cup-like base"
acres,a unit of land area equal to 4,840 square yards or 4,047 square meters,,,,,,No,"a unit of land area equal to 4,840 square yards or 4,047 square meters",,,,,,"a unit of land area equal to 4,840 square yards or 4,047 square meters"
acrid,having an irritatingly strong and unpleasant taste or smell,,,,,,,,No,having an irritatingly strong and unpleasant taste or smell,,,,,,having an irritatingly strong and unpleasant taste or smell
acted,performed a role or function; took action,,,,,,,,No,performed a role or function; took action,,,,,,performed a role or function; took action
actin,a protein found in all eukaryotic cells, where it plays a role in cell shape, cell division, and cell movement,,,,,No,"a protein found in all eukaryotic cells, where it plays a role in cell shape, cell division, and cell movement",,,,,,"a protein found in all eukaryotic cells, where it plays a role in cell shape, cell division, and cell movement"
actor,a person whose profession is acting on the stage, in films, or on television,,,,,,No,"a person whose profession is acting on the stage, in films, or on television",,,,,,"a person whose profession is acting on the stage, in films, or on television"
acute,of an angle, less than 90°,,,,,,,No,"of an angle, less than 90°",,,,,,"of an angle, less than 90°"
adage,a proverb or short statement expressing a general truth,,,,,,,,No,a proverb or short statement expressing a general truth,,,,,,a proverb or short statement expressing a general truth
adapt,to make (something) suitable for a new use or purpose; modify,,,,,,,,No,to make (something) suitable for a new use or purpose; modify,,,,,,to make (something) suitable for a new use or purpose; modify
added,combined or mixed with something else to increase the size, number, or amount,,,,,,No,"combined or mixed with something else to increase the size, number, or amount",,,,,,"combined or mixed with something else to increase the size, number, or amount"
adder,a small venomous snake,,,,,,,,No,a small venomous snake,,,,,,a small venomous snake
addle,to make (someone) unable to think clearly; confuse,,,,,,,,No,to make (someone) unable to think clearly; confuse,,,,,,to make (someone) unable to think clearly; confuse
adept,very skilled or proficient at something,,,,,,,,No,very skilled or proficient at something,,,,,,very skilled or proficient at something
adieu,a French term meaning farewell or goodbye,,,,,,,,No,a French term meaning farewell or goodbye,,,,,,a French term meaning farewell or goodbye
adios,a Spanish term meaning farewell or goodbye,,,,,,,,No,a Spanish term meaning farewell or goodbye,,,,,,a Spanish term meaning farewell or goodbye
adits,an entrance to a mine, tunnel, or cave,,,,,,No,"an entrance to a mine, tunnel, or cave",,,,,,"an entrance to a mine, tunnel, or cave"
adman,a person who works in advertising; an advertising executive,,,,,,,,No,a person who works in advertising; an advertising executive,,,,,,a person who works in advertising; an advertising executive
admin,abbreviation for administration or administrative,,,,,,,,No,abbreviation for administration or administrative,,,,,,abbreviation for administration or administrative
admit,to confess to be true or to be the case; acknowledge,,,,,,,,No,to confess to be true or to be the case; acknowledge,,,,,,to confess to be true or to be the case; acknowledge
adobe,a brick or building material made of sun-dried earth and straw.,,,,,,,,No,a brick or building material made of sun-dried earth and straw.,,,,,,a brick or building material made of sun-dried earth and straw.
adobo,a Philippine dish of meat or fish marinated in vinegar, soy sauce, garlic, and spices, then cooked until browned.,,,,No,"a Philippine dish of meat or fish marinated in vinegar, soy sauce, garlic, and spices, then cooked until browned.",,,,,,"a Philippine dish of meat or fish marinated in vinegar, soy sauce, garlic, and spices, then cooked until browned."
adopt,to take up or start to use or follow (an idea, method, or course of action).,,,,,,No,"to take up or start to use or follow (an idea, method, or course of action).",,,,,,"to take up or start to use or follow (an idea, method, or course of action)."
adore,to love and respect (someone) deeply.,,,,,,,,No,to love and respect (someone) deeply.,,,,,,to love and respect (someone) deeply.
adorn,to add beauty to; decorate.,,,,,,,,No,to add beauty to; decorate.,,,,,,to add beauty to; decorate.
adult,a person who is fully grown or developed.,,,,,,,,No,a person who is fully grown or developed.,,,,,,a person who is fully grown or developed.
adzes,a tool similar to an axe, with an arched blade at right angles to the handle, used for cutting or shaping large pieces of wood.,,,,,,No,"a tool similar to an axe, with an arched blade at right angles to the handle, used for cutting or shaping large pieces of wood.",,,,,,"a tool similar to an axe, with an arched blade at right angles to the handle, used for cutting or shaping large pieces of wood."
aegis,the protection, backing, or support of a particular person or organization.,,,,,,No,"the protection, backing, or support of a particular person or organization.",,,,,,"the protection, backing, or support of a particular person or organization."
aeons,an indefinitely long period of time; an age.,,,,,,,,No,an indefinitely long period of time; an age.,,,,,,an indefinitely long period of time; an age.
aerie,a large nest of a bird of prey, especially an eagle, typically built high in a tree or on a cliff.,,,,,,No,"a large nest of a bird of prey, especially an eagle, typically built high in a tree or on a cliff.",,,,,,"a large nest of a bird of prey, especially an eagle, typically built high in a tree or on a cliff."
affix,to attach, fasten, or stick (something) to something else.,,,,,,No,"to attach, fasten, or stick (something) to something else.",,,,,,"to attach, fasten, or stick (something) to something else."
afire,on fire; burning.,,,,,,,,No,on fire; burning.,,,,,,on fire; burning.
afoot,in preparation or progress; happening or beginning to happen.,,,,,,,,No,in preparation or progress; happening or beginning to happen.,,,,,,in preparation or progress; happening or beginning to happen.
afore,before (in time or place); in front of.,,,,,,,,No,before (in time or place); in front of.,,,,,,before (in time or place); in front of.
after,following in time or place; later than; subsequent to.,,,,,,,,No,following in time or place; later than; subsequent to.,,,,,,following in time or place; later than; subsequent to.
again,another time; once more.,,,,,,,,No,another time; once more.,,,,,,another time; once more.
agape,(of the mouth) wide open, especially with surprise or wonder.,,,,,,,No,"(of the mouth) wide open, especially with surprise or wonder.",,,,,,"(of the mouth) wide open, especially with surprise or wonder."
agate,a precious stone consisting of a hard variety of chalcedony, typically banded in appearance.,,,,,,,No,"a precious stone consisting of a hard variety of chalcedony, typically banded in appearance.",,,,,,"a precious stone consisting of a hard variety of chalcedony, typically banded in appearance."
agave,a plant native to hot, dry regions, especially the southwestern US and Mexico, that typically has a large rosette of thick, fleshy leaves.,,,,No,"a plant native to hot, dry regions, especially the southwestern US and Mexico, that typically has a large rosette of thick, fleshy leaves.",,,,,,"a plant native to hot, dry regions, especially the southwestern US and Mexico, that typically has a large rosette of thick, fleshy leaves."
agent,a person who acts on behalf of another person or group.,,,,,,,,No,a person who acts on behalf of another person or group.,,,,,,a person who acts on behalf of another person or group.
aggro,aggravation or aggression.,,,,,,,,No,aggravation or aggression.,,,,,,aggravation or aggression.
agile,able to move quickly and easily.,,,,,,,,No,able to move quickly and easily.,,,,,,able to move quickly and easily.
aging,the process of growing old or maturing.,,,,,,,,No,the process of growing old or maturing.,,,,,,the process of growing old or maturing.
aglow,lit up; glowing.,,,,,,,,No,lit up; glowing.,,,,,,lit up; glowing.
agony,extreme physical or mental suffering.,,,,,,,,No,extreme physical or mental suffering.,,,,,,extreme physical or mental suffering.
agora,a public open space used for assemblies and markets in ancient Greece.,,,,,,,,No,a public open space used for assemblies and markets in ancient Greece.,,,,,,a public open space used for assemblies and markets in ancient Greece.
agree,have the same opinion about something; concur.,,,,,,,,No,have the same opinion about something; concur.,,,,,,have the same opinion about something; concur.
ahead,in or toward the front; in advance.,,,,,,,,No,in or toward the front; in advance.,,,,,,in or toward the front; in advance.
ahold,hold onto or grasp (something).,,,,,,,,No,hold onto or grasp (something).,,,,,,hold onto or grasp (something).
aided,help, assist, or support (someone or something) in the achievement of something.,,,,,,No,"help, assist, or support (someone or something) in the achievement of something.",,,,,,"help, assist, or support (someone or something) in the achievement of something."
aider,a person who helps or assists someone.,,,,,,,,No,a person who helps or assists someone.,,,,,,a person who helps or assists someone.
aides,a person who acts as an assistant.,,,,,,,,No,a person who acts as an assistant.,,,,,,a person who acts as an assistant.
ailed,suffering from physical or mental illness.,,,,,,,,No,suffering from physical or mental illness.,,,,,,suffering from physical or mental illness.
aimed,point or direct (a weapon or camera) at a target.,,,,,,,,No,point or direct (a weapon or camera) at a target.,,,,,,point or direct (a weapon or camera) at a target.
aimer,a person who aims or directs something.,,,,,,,,No,a person who aims or directs something.,,,,,,a person who aims or directs something.
aioli,a Mediterranean sauce made of garlic and olive oil, typically served with fish and vegetables.,,,,,,,No,"a Mediterranean sauce made of garlic and olive oil, typically served with fish and vegetables.",,,,,,"a Mediterranean sauce made of garlic and olive oil, typically served with fish and vegetables."
aired,be broadcast on television or radio.,,,,,,,,No,be broadcast on television or radio.,,,,,,be broadcast on television or radio.
aisle,a passage between rows of seats in a building such as a church or theater, an aircraft, or train.,,,,,,No,"a passage between rows of seats in a building such as a church or theater, an aircraft, or train.",,,,,,"a passage between rows of seats in a building such as a church or theater, an aircraft, or train."
alarm,a sudden fear or distressing suspense caused by an awareness of danger; apprehension; fright.,,,,,,,,No,a sudden fear or distressing suspense caused by an awareness of danger; apprehension; fright.,,,,,,a sudden fear or distressing suspense caused by an awareness of danger; apprehension; fright.
album,a blank book for the insertion of photographs, stamps, or pictures.,,,,,,No,"a blank book for the insertion of photographs, stamps, or pictures.",,,,,,"a blank book for the insertion of photographs, stamps, or pictures."
alder,a tree of a genus that includes alders and hornbeams.,,,,,,,,No,a tree of a genus that includes alders and hornbeams.,,,,,,a tree of a genus that includes alders and hornbeams.
aleph,the first letter of the Hebrew alphabet.,,,,,,,,No,the first letter of the Hebrew alphabet.,,,,,,the first letter of the Hebrew alphabet.
alert,quick to notice any unusual and potentially dangerous or difficult circumstances; vigilant.,,,,,,,,No,quick to notice any unusual and potentially dangerous or difficult circumstances; vigilant.,,,,,,quick to notice any unusual and potentially dangerous or difficult circumstances; vigilant.
algae,a simple nonflowering plant of a large group that includes the seaweeds and many single-celled forms.,,,,,,,,No,a simple nonflowering plant of a large group that includes the seaweeds and many single-celled forms.,,,,,,a simple nonflowering plant of a large group that includes the seaweeds and many single-celled forms.
algal,relating to, containing, or consisting of algae.,,,,,,No,"relating to, containing, or consisting of algae.",,,,,,"relating to, containing, or consisting of algae."
alias,a false or assumed identity.,,,,,,,,No,a false or assumed identity.,,,,,,a false or assumed identity.
alibi,a claim or piece of evidence that one was elsewhere when an act, typically a criminal one, is alleged to have taken place.,,,,,,No,"a claim or piece of evidence that one was elsewhere when an act, typically a criminal one, is alleged to have taken place.",,,,,,"a claim or piece of evidence that one was elsewhere when an act, typically a criminal one, is alleged to have taken place."
alien,belonging to a foreign country or nation.,,,,,,,,No,belonging to a foreign country or nation.,,,,,,belonging to a foreign country or nation.
align,arrange in a line or bring into alignment.,,,,,,,,No,arrange in a line or bring into alignment.,,,,,,arrange in a line or bring into alignment.
alike,of similar qualities or character; similar to.,,,,,,,,No,of similar qualities or character; similar to.,,,,,,of similar qualities or character; similar to.
alive,alive.,,,,,,,,No,alive.,,,,,,alive.
alkyd,a synthetic resin used in paints and inks, especially one based on polyesters.,,,,,,,No,"a synthetic resin used in paints and inks, especially one based on polyesters.",,,,,,"a synthetic resin used in paints and inks, especially one based on polyesters."
alkyl,any of a series of univalent groups of the general formula CnH2n+1, including methyl, ethyl, propyl, and butyl.,,,,No,"any of a series of univalent groups of the general formula CnH2n+1, including methyl, ethyl, propyl, and butyl.",,,,,,"any of a series of univalent groups of the general formula CnH2n+1, including methyl, ethyl, propyl, and butyl."
allay,diminish or put at rest (fear, suspicion, or worry).,,,,,,No,"diminish or put at rest (fear, suspicion, or worry).",,,,,,"diminish or put at rest (fear, suspicion, or worry)."
alley,a narrow street or passageway, especially one through the middle of a block giving access to the rear of lots or buildings.,,,,,,,No,"a narrow street or passageway, especially one through the middle of a block giving access to the rear of lots or buildings.",,,,,,"a narrow street or passageway, especially one through the middle of a block giving access to the rear of lots or buildings."
allot,give or apportion (something) to someone as a share or task.,,,,,,,,No,give or apportion (something) to someone as a share or task.,,,,,,give or apportion (something) to someone as a share or task.
allow,permit; let.,,,,,,,,No,permit; let.,,,,,,permit; let.
alloy,a metal made by combining two or more metallic elements, especially to give greater strength or resistance to corrosion.,,,,,,,No,"a metal made by combining two or more metallic elements, especially to give greater strength or resistance to corrosion.",,,,,,"a metal made by combining two or more metallic elements, especially to give greater strength or resistance to corrosion."
allyl,a colorless volatile liquid obtained by the destructive distillation of garlic mustard and horseradish oil.,,,,,,,,No,a colorless volatile liquid obtained by the destructive distillation of garlic mustard and horseradish oil.,,,,,,a colorless volatile liquid obtained by the destructive distillation of garlic mustard and horseradish oil.
aloes,a succulent plant with spiny leaves and clusters of yellow, tubular flowers.,,,,,,,No,"a succulent plant with spiny leaves and clusters of yellow, tubular flowers.",,,,,,"a succulent plant with spiny leaves and clusters of yellow, tubular flowers."
aloft,up in or into the air; overhead.,,,,,,,,No,up in or into the air; overhead.,,,,,,up in or into the air; overhead.
aloha,a Hawaiian greeting or farewell.,,,,,,,,No,a Hawaiian greeting or farewell.,,,,,,a Hawaiian greeting or farewell.
alone,isolated or without companions.,,,,,,,,No,isolated or without companions.,,,,,,isolated or without companions.
along,in a line parallel to; by the length of.,,,,,,,,No,in a line parallel to; by the length of.,,,,,,in a line parallel to; by the length of.
aloof,not friendly or forthcoming; cool and distant.,,,,,,,,No,not friendly or forthcoming; cool and distant.,,,,,,not friendly or forthcoming; cool and distant.
aloud,audible to the ear; not silently or in a whisper.,,,,,,,,No,audible to the ear; not silently or in a whisper.,,,,,,audible to the ear; not silently or in a whisper.
alpha,the first letter of the Greek alphabet.,,,,,,,,No,the first letter of the Greek alphabet.,,,,,,the first letter of the Greek alphabet.
altar,the table in a Christian church at which the bread and wine are consecrated in communion services.,,,,,,,,No,the table in a Christian church at which the bread and wine are consecrated in communion services.,,,,,,the table in a Christian church at which the bread and wine are consecrated in communion services.
alter,change or cause to change in character or composition, typically in a comparatively small but significant way.,,,,,,,No,"change or cause to change in character or composition, typically in a comparatively small but significant way.",,,,,,"change or cause to change in character or composition, typically in a comparatively small but significant way."
altos,the highest adult male singing voice; countertenor.,,,,,,,,No,the highest adult male singing voice; countertenor.,,,,,,the highest adult male singing voice; countertenor.
alums,informal term for a graduate or former student, especially male, of a school, college, or university.,,,,No,"informal term for a graduate or former student, especially male, of a school, college, or university.",,,,,,"informal term for a graduate or former student, especially male, of a school, college, or university."
amass,gather together or accumulate (a large amount or number of material or things) over a period of time.,,,,,,,,No,gather together or accumulate (a large amount or number of material or things) over a period of time.,,,,,,gather together or accumulate (a large amount or number of material or things) over a period of time.
amaze,cause (someone) to be filled with wonder or astonishment.,,,,,,,,No,cause (someone) to be filled with wonder or astonishment.,,,,,,cause (someone) to be filled with wonder or astonishment.
amber,a hard translucent fossilized resin produced by extinct coniferous trees of the Tertiary period, typically yellowish in color.,,,,,,,No,"a hard translucent fossilized resin produced by extinct coniferous trees of the Tertiary period, typically yellowish in color.",,,,,,"a hard translucent fossilized resin produced by extinct coniferous trees of the Tertiary period, typically yellowish in color."
ambit,the scope, extent, or bounds of something.,,,,,,No,"the scope, extent, or bounds of something.",,,,,,"the scope, extent, or bounds of something."
amble,to walk or move at a slow, relaxed pace.,,,,,,,No,"to walk or move at a slow, relaxed pace.",,,,,,"to walk or move at a slow, relaxed pace."
ambos,a metallic clanging sound; a clanging sound made by a hammer.,,,,,,,,No,a metallic clanging sound; a clanging sound made by a hammer.,,,,,,a metallic clanging sound; a clanging sound made by a hammer.
amend,to make minor changes in (a text) in order to make it fairer, more accurate, or more up-to-date.,,,,,,No,"to make minor changes in (a text) in order to make it fairer, more accurate, or more up-to-date.",,,,,,"to make minor changes in (a text) in order to make it fairer, more accurate, or more up-to-date."
amide,any compound derived from ammonia by substitution of one or more hydrogen atoms with organic groups.,,,,,,,,No,any compound derived from ammonia by substitution of one or more hydrogen atoms with organic groups.,,,,,,any compound derived from ammonia by substitution of one or more hydrogen atoms with organic groups.
amine,an organic compound derived from ammonia by replacement of one or more hydrogen atoms by organic groups.,,,,,,,,No,an organic compound derived from ammonia by replacement of one or more hydrogen atoms by organic groups.,,,,,,an organic compound derived from ammonia by replacement of one or more hydrogen atoms by organic groups.
amino,relating to or containing an amino group.,,,,,,,,No,relating to or containing an amino group.,,,,,,relating to or containing an amino group.
amiss,not quite right; inappropriate or out of place.,,,,,,,,No,not quite right; inappropriate or out of place.,,,,,,not quite right; inappropriate or out of place.
amity,a friendly relationship.,,,,,,,,No,a friendly relationship.,,,,,,a friendly relationship.
amnio,short for amniocentesis.,,,,,,,,No,short for amniocentesis.,,,,,,short for amniocentesis.
among,surrounded by; in the company of.,,,,,,,,No,surrounded by; in the company of.,,,,,,surrounded by; in the company of.
amour,a secret love affair.,,,,,,,,No,a secret love affair.,,,,,,a secret love affair.
amped,excited or wired.,,,,,,,,No,excited or wired.,,,,,,excited or wired.
ample,enough or more than enough; plentiful.,,,,,,,,No,enough or more than enough; plentiful.,,,,,,enough or more than enough; plentiful.
amply,in a way that is more than adequate.,,,,,,,,No,in a way that is more than adequate.,,,,,,in a way that is more than adequate.
amuse,provide interesting and enjoyable occupation for (someone).,,,,,,,,No,provide interesting and enjoyable occupation for (someone).,,,,,,provide interesting and enjoyable occupation for (someone).
ancho,a dried and smoked poblano chili pepper.,,,,,,,,No,a dried and smoked poblano chili pepper.,,,,,,a dried and smoked poblano chili pepper.
